{
  "$schema": "../schemas/system.schema.json",

  "meta": {
    "title": "PWN — Contract-Governed Agent Harness",
    "version": 1,
    "last_reconciled": "2026-08-26",
    "scope": "o harness proprietário de camada 4 descrito em SPEC.md v1.2 — profiles, skills, rules, contratos, risco, pipelines, sub-agents, hooks, evidência, métricas, fila AFK, materialização de targets e o pack software-engineering. Runtimes (Pi, OpenCode, omp) e providers de modelo são externos."
  },

  "status": "Baseline parcial",

  "purpose": {
    "problem": "governança de agentes espalhada entre runtimes, diretórios globais e repositórios; executores têm espaço de decisão amplo demais, e a origem dos contratos (descoberta, requisitos, spec, plano) não é tão governada quanto a execução.",
    "result": "o operador humano obtém um harness CLI-first (pwn) que limita mecanicamente escopo, orçamento e superfície de escrita, seleciona validação proporcional ao risco e governa a cadeia Discovery → PRD → Spec → Plano com gates rastreáveis."
  },

  "boundary": {
    "inside": [
      "CLI pwn e todos os comandos de profile, skill, rule, agent, pipeline, queue, metrics, work e target",
      "Motor de contratos, risco e validação (Contract Engine v4)",
      "Pack oficial software-engineering (port v3 + cadeia de planejamento v4)",
      "Evidência, métricas, teach skills, memory e editor visual de pipelines"
    ],
    "outside": [
      "Runtimes Pi, OpenCode e omp (camada 2) — consumidos via adapters, não implementados aqui",
      "Providers de modelo LLM (Anthropic, OpenAI, modelos locais)",
      "O repositório original ai-engineering-skills — permanece independente e não é controlado"
    ]
  },

  "actors": [
    {
      "id": "ACT-001",
      "name": "Operador humano",
      "description": "define profiles, contratos e políticas; aprova gates e revisões; audita aceitação",
      "evidence": "decisão explícita do usuário (SPEC.md §2.1, §4.11)"
    },
    {
      "id": "ACT-002",
      "name": "Runtime Pi",
      "description": "runtime de camada 2 que consome artefatos materializados (SYSTEM.md, prompts, extensions, skills)",
      "evidence": "decisão explícita do usuário (SPEC.md §2.2, §6.1)"
    },
    {
      "id": "ACT-003",
      "name": "Runtime OpenCode",
      "description": "runtime de camada 2 que consome AGENTS.md, opencode.jsonc, agents e skills",
      "evidence": "decisão explícita do usuário (SPEC.md §2.2, §6.2)"
    },
    {
      "id": "ACT-004",
      "name": "Runtime omp",
      "description": "runtime de camada 2 que consome config.yml, system prompt e agents/*.md",
      "evidence": "decisão explícita do usuário (SPEC.md §2.2, §6.3)"
    },
    {
      "id": "ACT-005",
      "name": "Repositório ai-engineering-skills",
      "description": "origem independente do port, nunca alterado pelo PWN",
      "evidence": "decisão explícita do usuário (SPEC.md §10.1, §2.10)"
    }
  ],

  "capabilities": [
    {
      "id": "CAP-001",
      "title": "Governança por contratos executáveis",
      "value": "restringir decisões do executor antes da execução e impor limites mecanicamente",
      "actors": ["ACT-001"],
      "behavior": "todo executor recebe uma ordem de serviço congelada com sete dimensões (behavioral, change, architecture, acceptance, scope, budget, escalation); a allowlist de escrita é verificada pelo diff e pelas tool calls; expansão de escrita exige revisão e revalidação",
      "failures": "escrita fora da allowlist é bloqueada; budget estourado, tentativas excedidas ou conflito de contrato disparam escalação, nunca execução silenciosa",
      "rules": ["BR-001", "BR-002", "BR-003", "BR-008"],
      "contracts": ["CON-001", "CON-006"],
      "evidence": "decisão explícita do usuário (SPEC.md §4.1, §4.2)"
    },
    {
      "id": "CAP-002",
      "title": "Composição declarativa de perfis e primitivas",
      "value": "montar um harness por composição de profiles, skills, rules, sub-agents e hooks, sem mega-config",
      "actors": ["ACT-001"],
      "behavior": "um profile declara identidade, modelo, skills/rules/hooks e sub-agents; rules são concatenadas em ordem; skills são ativadas por trigger; sub-agents são selecionados pelo step do pipeline",
      "failures": "conflito de nome entre origens bloqueia a materialização até qualificação explícita; o framework nunca remove rules silenciosamente",
      "rules": ["BR-009"],
      "contracts": ["CON-004", "CON-007"],
      "evidence": "decisão explícita do usuário (SPEC.md §4.4, §4.5, §4.6, §4.7)"
    },
    {
      "id": "CAP-003",
      "title": "Pipelines declarativos e determinísticos",
      "value": "definir a topologia do processo antes da execução; steps usam sub-agents, gates e checkpoints humanos",
      "actors": ["ACT-001"],
      "behavior": "o pipeline JSON declara steps, condições, limites de iteração e checkpoints; dry-run resolve sem invocar runtime; run invoca o runtime headless por step e alimenta o step seguinte",
      "failures": "nenhum LLM decide a topologia no MVP; steps type:gate bloqueiam o avanço em finding material",
      "rules": ["BR-010"],
      "contracts": ["CON-002"],
      "evidence": "decisão explícita do usuário (SPEC.md §2.6, §4.8)"
    },
    {
      "id": "CAP-004",
      "title": "Materialização para targets com capability matrix",
      "value": "gerar artefatos nativos de cada runtime sem perda silenciosa de campos",
      "actors": ["ACT-001", "ACT-002", "ACT-003", "ACT-004"],
      "behavior": "o materializer lê profile + skills + rules + sub-agents e gera artefatos por target (Pi, OpenCode, omp, raw); cada capacidade é verificada, emulada ou declarada não suportada",
      "failures": "campo não representável causa falha ou degradação explícita; dry-run expõe capacidades desconhecidas",
      "rules": ["BR-007"],
      "contracts": ["CON-004"],
      "evidence": "decisão explícita do usuário (SPEC.md §6, §6.5)"
    },
    {
      "id": "CAP-005",
      "title": "Execução AFK com fila e revisão humana",
      "value": "executar works away-from-keyboard em sandbox isolado, com checkpoint humano",
      "actors": ["ACT-001"],
      "behavior": "runs são serializadas em queue/review/, pausam sem bloquear stdin e retomam do checkpoint após pwn queue review; sandbox default é worktree por run",
      "failures": "sem autoaprovação por timeout; conclusão exige evidência real",
      "rules": ["BR-001"],
      "contracts": ["CON-005"],
      "evidence": "decisão explícita do usuário (SPEC.md §4.11, §5.1)"
    },
    {
      "id": "CAP-006",
      "title": "Métricas e otimização",
      "value": "medir custo, duração, tentativas, escalações e qualidade do processo para calibrar o harness",
      "actors": ["ACT-001"],
      "behavior": "toda execução produz um registro de métricas; pwn metrics optimize produz recomendações revisáveis, sem aplicação automática",
      "failures": "métrica indisponível vira N/A, nunca valor inventado; recomendações não alteram policy automaticamente",
      "rules": ["BR-008"],
      "contracts": ["CON-003"],
      "evidence": "decisão explícita do usuário (SPEC.md §4.12, §8)"
    },
    {
      "id": "CAP-007",
      "title": "Teach skills com estado",
      "value": "skills que entrevistam o operador e melhoram progressivamente",
      "actors": ["ACT-001"],
      "behavior": "teach skills persistem estado bruto gitignored e promovem aprendizados destilados para learnings.yaml versionado",
      "failures": "estado bruto não é versionado; promoção é manual e sanitizada; dados sensíveis nunca são promovidos automaticamente",
      "rules": ["BR-009"],
      "contracts": ["CON-007"],
      "evidence": "decisão explícita do usuário (SPEC.md §4.5, §7, DEC-006)"
    },
    {
      "id": "CAP-008",
      "title": "Editor visual de pipelines",
      "value": "inspecionar, desenhar e editar pipelines/sub-agents/contratos sem editar JSON manualmente",
      "actors": ["ACT-001"],
      "behavior": "artefato file:// auto-contido abre, valida e exporta pipelines; valida contra pipeline.schema.json; salva por File System Access API com fallback de download",
      "failures": "não executa agents, commands, hooks ou pipelines; não recebe secrets; round-trip não preserva comentários/âncoras",
      "rules": ["BR-010"],
      "contracts": ["CON-009"],
      "evidence": "decisão explícita do usuário (SPEC.md §9, DEC-020, DEC-021)"
    },
    {
      "id": "CAP-009",
      "title": "Pack oficial software-engineering (port)",
      "value": "distribuir o workflow v3 portado com proveniência, evoluindo para v4 sem migrar Works antigos",
      "actors": ["ACT-001", "ACT-005"],
      "behavior": "o port copia skills/workflows/scripts/testes/docs/adapters para packs/software-engineering; PORTED_FROM.md registra origem, commit e inventário; adapters /pwn-* coexistem com /make-*",
      "failures": "a origem nunca é removida/alterada; atualização futura exige pwn pack diff + port explícito; sem sincronização bidirecional",
      "rules": ["BR-004", "BR-005"],
      "contracts": ["CON-008"],
      "evidence": "decisão explícita do usuário (SPEC.md §10.1, §10.2, §10.6)"
    },
    {
      "id": "CAP-010",
      "title": "Cadeia de planejamento governada",
      "value": "governar a origem dos contratos com artefatos rastreáveis e gates de cobertura/consistência",
      "actors": ["ACT-001"],
      "behavior": "intake → discovery → requirements → PRD → decisões → spec → validação → enriquecimento → work-governance → plan → validação → task-contract, com matriz de rastreabilidade e IDs estáveis",
      "failures": "gate bloqueia em finding material; revisor não reescreve escopo; enriquecimento não introduz features silenciosamente",
      "rules": ["BR-005", "BR-006", "BR-008"],
      "contracts": ["CON-001", "CON-002", "CON-006"],
      "evidence": "decisão explícita do usuário (SPEC.md §10.8, §10.9, §10.10)"
    }
  ],

  "rules": [
    {
      "id": "BR-001",